{
 "$schema": "https://json-schema.org/draft/2020-12/schema",
 "$id": "https://builderpluss.dev/library/Schemas/run.v1.schema.json",
 "title": "run/1 — the record of one pipeline run, published to Projects/<CODE>/runs/<pipeline>/<run_id>/run.json",
 "description": "Says what went in, which library versions were used, what came out (with hashes), and who approved the gates. Large binaries keep only the latest copy in R2; their hash here identifies which run made it.",
 "type": "object",
 "required": ["schema", "run_id", "project", "pipeline", "started", "finished", "status", "inputs", "library", "outputs", "tasks"],
 "additionalProperties": false,
 "properties": {
  "schema": { "const": "run/1" },
  "run_id": { "type": "string", "pattern": "^\\d{8}T\\d{6}Z?$", "description": "UTC timestamp, e.g. 20261007T101500Z" },
  "project": { "type": "string", "pattern": "^[A-Z0-9_]+$" },
  "pipeline": {
   "type": "object",
   "required": ["id", "version"],
   "additionalProperties": false,
   "properties": {
    "id": { "type": "string" },
    "version": { "type": "string" },
    "kit": { "type": "string" }
   }
  },
  "agent": { "type": "string" },
  "fixture": { "type": "boolean" },
  "started": { "$ref": "#/$defs/time" },
  "finished": { "$ref": "#/$defs/time" },
  "status": { "enum": ["done", "partial", "blocked", "failed"] },
  "inputs": { "type": "array", "items": { "$ref": "#/$defs/file" } },
  "library": {
   "type": "array",
   "items": {
    "type": "object",
    "required": ["path"],
    "additionalProperties": false,
    "properties": {
     "path": { "type": "string", "pattern": "^library/" },
     "version": { "type": "string" },
     "sha256": { "$ref": "#/$defs/sha" },
     "source": { "enum": ["r2", "local_copy", "vendored"] }
    }
   }
  },
  "outputs": {
   "type": "array",
   "items": {
    "allOf": [
     { "$ref": "#/$defs/file" },
     {
      "type": "object",
      "required": ["key"],
      "properties": {
       "key": { "type": "string", "pattern": "^Projects/" },
       "schema": { "type": "string" },
       "valid": { "type": "boolean" },
       "binary": { "type": "boolean" },
       "skipped_unchanged": { "type": "boolean" }
      }
     }
    ]
   }
  },
  "tasks": {
   "type": "array",
   "items": {
    "type": "object",
    "required": ["task_id", "status"],
    "additionalProperties": false,
    "properties": {
     "task_id": { "type": "string" },
     "status": { "enum": ["todo", "running", "done", "blocked", "skipped", "failed"] },
     "approved": { "type": "string", "description": "the user's words + date, or FIXTURE …" },
     "notes": { "type": "string" }
    }
   }
  },
  "promoted": {
   "type": "array",
   "description": "library items this run published, each with the approval",
   "items": {
    "type": "object",
    "required": ["path", "version", "approved"],
    "additionalProperties": false,
    "properties": { "path": { "type": "string", "pattern": "^library/" }, "version": { "type": "string" }, "approved": { "type": "string" } }
   }
  },
  "notes": { "type": "string" }
 },
 "$defs": {
  "sha": { "type": "string", "pattern": "^[0-9a-f]{64}$" },
  "time": { "type": "string", "pattern": "^\\d{4}-\\d{2}-\\d{2}T\\d{2}:\\d{2}:\\d{2}(\\.\\d+)?(Z|[+-]\\d{2}:\\d{2})$" },
  "file": {
   "type": "object",
   "required": ["id", "sha256", "bytes"],
   "properties": {
    "id": { "type": "string" },
    "key": { "type": "string" },
    "local": { "type": "string" },
    "sha256": { "$ref": "#/$defs/sha" },
    "bytes": { "type": "integer", "minimum": 0 }
   }
  }
 }
}
