{
 "schema": "run/1",
 "run_id": "20261006T161606Z",
 "project": "WINDSOR_B1",
 "pipeline": {
  "id": "floorplan-tracer",
  "version": "0.1.0",
  "kit": "0.2.0"
 },
 "agent": "claude-code",
 "fixture": true,
 "started": "2026-10-06T14:44:45Z",
 "finished": "2026-10-06T16:16:06Z",
 "status": "partial",
 "inputs": [
  {
   "id": "source",
   "key": "library/Images/Windsor_park.jpeg",
   "sha256": "d6b1cade3bc3f9b71c3c2f5e021985ef197b7ac651d89b316fd812f60bfae94c",
   "bytes": 156406
  }
 ],
 "library": [
  {
   "path": "library/Standards/DEFAULT.json",
   "sha256": "c91a9e0aca7b0a096579b30ecceaf61003f26928edfbe5cec87e00d46dd76410",
   "source": "local_copy"
  },
  {
   "path": "library/Pipelines/_kit/",
   "version": "0.2.0",
   "source": "vendored"
  }
 ],
 "outputs": [
  {
   "id": "plan",
   "key": "Projects/WINDSOR_B1/plan/plan.json",
   "local": "public/floorplan-tracer-pipeline/projects/WINDSOR_B1/plan.json",
   "sha256": "a968a480c0ad521319b1566259c3c766c2037df68a5e1479871c40313cc32257",
   "bytes": 37070,
   "schema": "tracer-plan.v1"
  },
  {
   "id": "layout",
   "key": "Projects/WINDSOR_B1/plan/layout.json",
   "local": "public/floorplan-tracer-pipeline/projects/WINDSOR_B1/layout.json",
   "sha256": "41cfe5b603821f70eab9e87c9bc080e98fd51a08cf735a458b5ceb431a2640e6",
   "bytes": 16346,
   "schema": "tracer-layout.v1"
  },
  {
   "id": "canvas",
   "key": "Projects/WINDSOR_B1/plan/WINDSOR_B1.canvas.json",
   "local": "pipeline-work/tracer/WINDSOR_B1/out/WINDSOR_B1.canvas.json",
   "sha256": "0d9ffd6d756a7a351e277f1da16ec981bc7b682d38499ce8b40599f8acec28c6",
   "bytes": 73825,
   "schema": "canvas.v1"
  },
  {
   "id": "plan_trace",
   "key": "Projects/WINDSOR_B1/plan/plan_trace.json",
   "local": "pipeline-work/tracer/WINDSOR_B1/out/plan_trace.json",
   "sha256": "d816caab9ff8e8aa1bf056da0c2a80f247bd2c6deabf5dedbd229a6da66bf05b",
   "bytes": 18819,
   "schema": "plan_trace-tracer.v0"
  },
  {
   "id": "svg",
   "key": "Projects/WINDSOR_B1/plan/WINDSOR_B1_L0.svg",
   "local": "pipeline-work/tracer/WINDSOR_B1/out/WINDSOR_B1_L0.svg",
   "sha256": "b5ec7a0d35087e7ce972d97642cd5916394fa598a19c7859e1938c1fe3e823b5",
   "bytes": 23800
  },
  {
   "id": "overlay",
   "key": "Projects/WINDSOR_B1/plan/WINDSOR_B1_L0_overlay.png",
   "local": "pipeline-work/tracer/WINDSOR_B1/out/WINDSOR_B1_L0_overlay.png",
   "sha256": "a104ee8c187af77b1caed0e0ea13964eb3f33ddf02464bbed27c97dbd0691df1",
   "bytes": 1397105,
   "binary": true
  },
  {
   "id": "handoff",
   "key": "Projects/WINDSOR_B1/plan/handoff.json",
   "local": "public/floorplan-tracer-pipeline/projects/WINDSOR_B1/handoff.json",
   "sha256": "7005d5887a3fdad150d9a2eb8dc9023d3775fc9b0911c5e21c0d273be660e88a",
   "bytes": 470
  },
  {
   "id": "report",
   "key": "Projects/WINDSOR_B1/runs/floorplan-tracer/REPORT.md",
   "local": "public/floorplan-tracer-pipeline/projects/WINDSOR_B1/REPORT.md",
   "sha256": "3e47e398786d1413a8baba199037c781e0c2a9a40f6635a872d2c00cdaffbac8",
   "bytes": 2165
  }
 ],
 "tasks": [
  {
   "task_id": "S0_SCOPE",
   "status": "done",
   "approved": "FIXTURE — regression run by the agent (2026-10-06)"
  },
  {
   "task_id": "S1_INTAKE",
   "status": "done",
   "approved": "FIXTURE — manifest checked by the agent"
  },
  {
   "task_id": "S2_READ",
   "status": "done"
  },
  {
   "task_id": "S3_DIMENSIONS",
   "status": "done"
  },
  {
   "task_id": "S4_LAYOUT",
   "status": "done"
  },
  {
   "task_id": "S5_BUILD",
   "status": "done"
  },
  {
   "task_id": "S6_VERIFY",
   "status": "done"
  },
  {
   "task_id": "S7_EXPORT",
   "status": "done"
  },
  {
   "task_id": "S8_REVIEW",
   "status": "done",
   "approved": "FIXTURE — kit 0.2.0 publish test by the agent (2026-10-07)"
  }
 ],
 "notes": "example built from the 2026-10-06 regression run; S8_REVIEW not approved, so only ungated outputs would publish"
}